{
  "$schema": "./motion-patterns.schema.json",
  "schemaVersion": 2,
  "catalogVersion": "0.2.0",
  "updatedAt": "2026-07-16",
  "patterns": [
    {
      "id": "editorial-curtain-reveal",
      "title": "Editorial Curtain Reveal",
      "status": "recipe",
      "effectJob": "hierarchy",
      "narrativeRole": "Reveal a decisive headline and media field as one composed opening beat.",
      "suitableFor": ["editorial", "culture", "hospitality", "luxury", "portfolio"],
      "avoidFor": ["dense dashboards", "urgent transactional flows"],
      "trigger": "load",
      "assetCost": "medium",
      "performanceBudget": { "runtimeJsKbMax": 35, "mediaMbMax": 1.8, "preferredProperties": ["transform", "opacity", "clip-path"], "fallbackRequired": true },
      "timeline": [
        { "at": 0, "layer": "surface", "action": "Render complete final content below an opaque curtain.", "durationMs": 0, "easing": "linear" },
        { "at": 0.08, "layer": "headline", "action": "Reveal lines with small upward travel and stagger.", "durationMs": 720, "easing": "cubic-bezier(0.22,1,0.36,1)" },
        { "at": 0.22, "layer": "curtain", "action": "Translate curtain out while opening the media mask.", "durationMs": 920, "easing": "cubic-bezier(0.76,0,0.24,1)" },
        { "at": 0.55, "layer": "utility", "action": "Fade proof and primary action into the settled composition.", "durationMs": 360, "easing": "ease-out" }
      ],
      "desktopPlan": "Use one full-viewport curtain and one media mask; navigation remains usable from the first painted frame.",
      "mobileAlternative": "Shorten travel, remove line-by-line delay, and reveal the CTA before the media completes.",
      "reducedMotion": "Skip curtain travel and render the complete final frame immediately with no hidden content.",
      "noJsPlan": "CSS defaults are the settled frame; an enhancement class enables the staged reveal only after initialization.",
      "implementation": { "preferred": ["CSS", "GSAP timeline"], "fallback": "Single opacity transition on the media only.", "ownershipRule": "Only one timeline owns transform and clip-path for each layer." },
      "failureModes": ["blank first viewport", "navigation delayed", "headline unreadable mid-state", "clip-path raster jank"],
      "verificationContract": ["capture 0/150/400/800/1400/2200ms", "CTA usable by 1400ms", "reduced-motion final frame complete", "no layout shift"],
      "sourceReferences": [{ "referenceId": "ref-022", "relationship": "expressive entrance hypothesis", "status": "hypothesis" }],
      "rights": { "recipeOwnership": "original-abstraction", "implementationLicense": "MIT", "thirdPartyAssetsAllowed": false }
    },
    {
      "id": "pinned-chapter-hand-off",
      "title": "Pinned Chapter Hand-off",
      "status": "recipe",
      "effectJob": "orientation",
      "narrativeRole": "Hold one media stage while narrative chapters exchange without losing scroll position.",
      "suitableFor": ["product", "editorial", "hospitality", "data narrative", "case study"],
      "avoidFor": ["short pages", "content that must be scanned rapidly"],
      "trigger": "scroll",
      "assetCost": "medium",
      "performanceBudget": { "runtimeJsKbMax": 45, "mediaMbMax": 3, "preferredProperties": ["transform", "opacity"], "fallbackRequired": true },
      "timeline": [
        { "at": 0, "layer": "chapter-1", "action": "Show complete first chapter at pin entry.", "durationMs": 0, "easing": "linear" },
        { "at": 0.28, "layer": "chapter-1", "action": "Reduce emphasis while preserving context.", "durationMs": 260, "easing": "ease-out" },
        { "at": 0.34, "layer": "media", "action": "Morph or crossfade to the next proof state.", "durationMs": 520, "easing": "cubic-bezier(0.22,1,0.36,1)" },
        { "at": 0.42, "layer": "chapter-2", "action": "Bring the next label, claim, and proof into reading order.", "durationMs": 360, "easing": "ease-out" }
      ],
      "desktopPlan": "Pin for no more than roughly two viewports per three chapters and show useful content at pin entry.",
      "mobileAlternative": "Remove the pin; stack chapter cards with short intersection reveals and persistent media thumbnails.",
      "reducedMotion": "Render all chapters in document flow with their final proof states and no scrub dependency.",
      "noJsPlan": "Use a semantic chapter list followed by media; sticky enhancement is optional.",
      "implementation": { "preferred": ["GSAP ScrollTrigger", "CSS sticky"], "fallback": "CSS sticky media plus non-animated chapter list.", "ownershipRule": "The chapter controller owns pinning; child components never create competing scroll locks." },
      "failureModes": ["blank pin entry", "excessive scroll distance", "wheel trapping", "mobile viewport jump", "content unavailable without scrub"],
      "verificationContract": ["capture pin entry and every hand-off", "normal scrolling remains possible", "mobile has no pin", "reduced motion exposes every chapter"],
      "sourceReferences": [{ "referenceId": "ref-002", "relationship": "calm scroll chapter hypothesis", "status": "hypothesis" }],
      "rights": { "recipeOwnership": "original-abstraction", "implementationLicense": "MIT", "thirdPartyAssetsAllowed": false }
    },
    {
      "id": "kinetic-type-line-reveal",
      "title": "Kinetic Type Line Reveal",
      "status": "recipe",
      "effectJob": "hierarchy",
      "narrativeRole": "Turn editorial line breaks into an intentional reading sequence.",
      "suitableFor": ["editorial", "agency", "portfolio", "campaign", "luxury"],
      "avoidFor": ["long body copy", "localization with unstable wrapping"],
      "trigger": "load",
      "assetCost": "low",
      "performanceBudget": { "runtimeJsKbMax": 12, "mediaMbMax": 0, "preferredProperties": ["transform", "opacity"], "fallbackRequired": true },
      "timeline": [
        { "at": 0, "layer": "headline", "action": "Keep every line clipped by its own overflow wrapper.", "durationMs": 0, "easing": "linear" },
        { "at": 0.08, "layer": "line-1", "action": "Translate from 105 percent to zero.", "durationMs": 680, "easing": "cubic-bezier(0.16,1,0.3,1)" },
        { "at": 0.14, "layer": "remaining-lines", "action": "Repeat with 70ms stagger.", "durationMs": 680, "easing": "cubic-bezier(0.16,1,0.3,1)" },
        { "at": 0.4, "layer": "support", "action": "Fade support copy and action without vertical travel.", "durationMs": 300, "easing": "ease-out" }
      ],
      "desktopPlan": "Lock art-directed line breaks only where the locale and viewport contract are known.",
      "mobileAlternative": "Recompute line groups after fonts load, cap the stagger, and never split individual characters by default.",
      "reducedMotion": "Remove clipping and transform; render all lines in their final positions.",
      "noJsPlan": "Headline is visible by default and wrappers are clipped only after the enhancement class is set.",
      "implementation": { "preferred": ["CSS", "GSAP SplitText when licensed"], "fallback": "Author explicit line spans in controlled marketing copy.", "ownershipRule": "The reveal owns line transforms; hover effects target a separate descendant." },
      "failureModes": ["flash of hidden text", "incorrect line grouping", "screen-reader fragmentation", "stagger longer than comprehension benefit"],
      "verificationContract": ["test shortest mobile height", "test longest supported locale", "DOM reading order remains natural", "final frame appears without JavaScript"],
      "sourceReferences": [{ "referenceId": "ref-022", "relationship": "type reveal hypothesis", "status": "hypothesis" }],
      "rights": { "recipeOwnership": "original-abstraction", "implementationLicense": "MIT", "thirdPartyAssetsAllowed": false }
    },
    {
      "id": "floating-image-convergence",
      "title": "Floating Image Convergence",
      "status": "candidate",
      "effectJob": "pacing",
      "narrativeRole": "Gather spatially scattered place or product fragments into one decisive focal image.",
      "suitableFor": ["hospitality", "travel", "fashion", "culture", "architecture"],
      "avoidFor": ["weak asset sets", "conversion forms", "dense content"],
      "trigger": "scroll",
      "assetCost": "high",
      "performanceBudget": { "runtimeJsKbMax": 40, "mediaMbMax": 4, "preferredProperties": ["transform", "opacity"], "fallbackRequired": true },
      "timeline": [
        { "at": 0, "layer": "image-fragments", "action": "Place three to five cropped fragments around a readable text core.", "durationMs": 0, "easing": "linear" },
        { "at": 0.2, "layer": "fragments", "action": "Move fragments toward a shared center while reducing rotation.", "durationMs": 900, "easing": "linear" },
        { "at": 0.62, "layer": "lead-image", "action": "Expand the strongest image to the narrative focal plane.", "durationMs": 700, "easing": "cubic-bezier(0.22,1,0.36,1)" },
        { "at": 0.78, "layer": "caption", "action": "Reveal location, object, or proof context.", "durationMs": 260, "easing": "ease-out" }
      ],
      "desktopPlan": "Use art-directed crops and avoid covering the primary reading column at every sampled state.",
      "mobileAlternative": "Use one lead image plus two small supporting images in normal flow; no convergence scrub.",
      "reducedMotion": "Render the final lead image and supporting strip without transforms.",
      "noJsPlan": "A static editorial collage remains complete and ordered.",
      "implementation": { "preferred": ["GSAP ScrollTrigger", "CSS custom properties"], "fallback": "Static asymmetric collage.", "ownershipRule": "One scroll timeline owns all fragment transforms." },
      "failureModes": ["generic stock collage", "text occlusion", "large decoded media footprint", "mobile crops lose subject"],
      "verificationContract": ["record 0/25/50/75/100 percent", "verify focal crop at each state", "media budget passes", "mobile composition is independently art-directed"],